{"policies":[{"allowed_signer_key_ids":[],"artifact":{"path":"policy.yaml","sha256":"sha256:8bf69040e4226afef012d70f9bc3b7dc5c66602eaca027a543ebf870f0eaacf2"},"content_hash":"sha256:cf29a25e6abd854b4f154eaefe64ed1191cd938cb1db98ede8a5592aa932071d"}],"profile_version":"0.1.0","requirements":{"boundary_inventory":false,"policy_signatures":false},"run_id":"shape-only","streams":[{"allowed_policy_hashes":["sha256:cf29a25e6abd854b4f154eaefe64ed1191cd938cb1db98ede8a5592aa932071d"],"allowed_signer_key_ids":["sha256:1187bb3ca0fd60b25cb90390812fb3a90823466b499e9c29effcc9f3c4ce6142"],"files":[{"path":"evidence.jsonl","sha256":"sha256:8a676d301e9d741aeadab996eb279de7e52e9f9b34b586a6069b63fa23033a3b"}],"id":"agent-1","kind":"signed-receipts"}],"window":{"since":"2026-09-15T00:00:00.000Z","until":"2026-09-16T00:00:00.000Z"}}